[{"scenario_id": "arm-7-000", "arm": 7, "requester_id": "b3e3ea0e-ad69-fb97-274e-a644f4dfed08", "action_type": "transfer", "resource": "res_bbw3ms34b9ui", "t_decision": 85.903, "t_bind": 103.983, "t_execution": 137.481, "multistep": false, "revocation": {"t_revoke": 136.533, "propagation_delay": 3.242, "reason": "api_key_rotation"}, "reauthorization": null}, {"scenario_id": "arm-7-001", "arm": 7, "requester_id": "3b03bed4-1617-1d7a-e07f-f37bc40f85e9", "action_type": "revoke", "resource": "asset_gxvb6i2otjea", "t_decision": 47.443, "t_bind": 49.515, "t_execution": 107.342, "multistep": false, "revocation": {"t_revoke": 104.642, "propagation_delay": 5.19, "reason": "emergency_shutdown"}, "reauthorization": null}, {"scenario_id": "arm-7-002", "arm": 7, "requester_id": "7f6d8bf5-ae14-1280-f3e4-a1317fddffba", "action_type": "execute", "resource": "asset_0tkfmqhvj00g", "t_decision": 49.792, "t_bind": 79.147, "t_execution": 127.981, "multistep": false, "revocation": {"t_revoke": 125.451, "propagation_delay": 4.944, "reason": "employee_termination"}, "reauthorization": null}, {"scenario_id": "arm-7-003", "arm": 7, "requester_id": "d65daf3b-ac0e-088b-c1fc-c86874b8f4e9", "action_type": "revoke", "resource": "obj_s50gfpf67eip", "t_decision": 34.256, "t_bind": 36.753, "t_execution": 143.801, "multistep": false, "revocation": {"t_revoke": 143.022, "propagation_delay": 2.356, "reason": "policy_change"}, "reauthorization": null}, {"scenario_id": "arm-7-004", "arm": 7, "requester_id": "b9bce710-a73c-fa53-e747-fd25cee38dcb", "action_type": "revoke", "resource": "item_fj4o3d894puo", "t_decision": 27.182, "t_bind": 32.565, "t_execution": 133.738, "multistep": false, "revocation": {"t_revoke": 132.806, "propagation_delay": 3.854, "reason": "credential_compromise"}, "reauthorization": null}, {"scenario_id": "arm-7-005", "arm": 7, "requester_id": "fe0feb2c-efa9-1f79-983c-8c16ceece085", "action_type": "transfer", "resource": "item_1ivun7fcct3h", "t_decision": 17.17, "t_bind": 41.842, "t_execution": 141.564, "multistep": false, "revocation": {"t_revoke": 140.717, "propagation_delay": 3.685, "reason": "employee_termination"}, "reauthorization": null}, {"scenario_id": "arm-7-006", "arm": 7, "requester_id": "8cb7cbfb-be3d-4bd6-951e-e8d5e07e2bb0", "action_type": "execute", "resource": "obj_rv3z63pgs2jb", "t_decision": 35.249, "t_bind": 39.983, "t_execution": 155.186, "multistep": false, "revocation": {"t_revoke": 154.94, "propagation_delay": 3.83, "reason": "api_key_rotation"}, "reauthorization": null}, {"scenario_id": "arm-7-007", "arm": 7, "requester_id": "f3f3bcae-0be5-f161-ecbd-3d6edaf57bb2", "action_type": "transfer", "resource": "obj_5ebc5ptfmryn", "t_decision": 69.547, "t_bind": 88.818, "t_execution": 160.386, "multistep": false, "revocation": {"t_revoke": 157.545, "propagation_delay": 4.513, "reason": "emergency_shutdown"}, "reauthorization": null}, {"scenario_id": "arm-7-008", "arm": 7, "requester_id": "a6f114e8-ecf2-f242-a0c9-b6f6d27de9ba", "action_type": "execute", "resource": "obj_54vfcsuufwsh", "t_decision": 97.513, "t_bind": 99.227, "t_execution": 200.89, "multistep": false, "revocation": {"t_revoke": 199.215, "propagation_delay": 6.664, "reason": "emergency_shutdown"}, "reauthorization": null}, {"scenario_id": "arm-7-009", "arm": 7, "requester_id": "6ef6caa6-8ded-88ba-514a-c74e8a289a2d", "action_type": "delegate", "resource": "item_dj0jsn3ta372", "t_decision": 6.572, "t_bind": 17.909, "t_execution": 106.065, "multistep": false, "revocation": {"t_revoke": 104.97, "propagation_delay": 1.816, "reason": "credential_compromise"}, "reauthorization": null}, {"scenario_id": "arm-7-010", "arm": 7, "requester_id": "f1cbd1f0-cfb6-6fbf-ce6d-d9055b04eab7", "action_type": "revoke", "resource": "item_upo06kq7usur", "t_decision": 78.873, "t_bind": 107.602, "t_execution": 205.421, "multistep": false, "revocation": {"t_revoke": 203.071, "propagation_delay": 3.741, "reason": "policy_change"}, "reauthorization": null}, {"scenario_id": "arm-7-011", "arm": 7, "requester_id": "59f88a9b-b76f-9d6f-d0d8-e0e726b8b522", "action_type": "transfer", "resource": "obj_bl138mbgtsmv", "t_decision": 82.133, "t_bind": 98.07, "t_execution": 179.079, "multistep": false, "revocation": {"t_revoke": 176.49, "propagation_delay": 5.091, "reason": "api_key_rotation"}, "reauthorization": null}, {"scenario_id": "arm-7-012", "arm": 7, "requester_id": "9c02f716-dbe4-f15e-db75-70eb4c283e88", "action_type": "delegate", "resource": "item_vuitsqi463j7", "t_decision": 72.807, "t_bind": 78.585, "t_execution": 182.215, "multistep": false, "revocation": {"t_revoke": 179.641, "propagation_delay": 6.884, "reason": "employee_termination"}, "reauthorization": null}, {"scenario_id": "arm-7-013", "arm": 7, "requester_id": "8108fb51-bafc-c200-6869-1cc3aac8e9ac", "action_type": "delegate", "resource": "res_8c4otgjuq0qw", "t_decision": 47.154, "t_bind": 75.327, "t_execution": 147.61, "multistep": false, "revocation": {"t_revoke": 145.757, "propagation_delay": 3.717, "reason": "credential_compromise"}, "reauthorization": null}, {"scenario_id": "arm-7-014", "arm": 7, "requester_id": "ed0ae60b-eddb-9a0d-15be-1ff28e0accd3", "action_type": "revoke", "resource": "item_4u1swwr8ilho", "t_decision": 29.71, "t_bind": 35.636, "t_execution": 155.341, "multistep": false, "revocation": {"t_revoke": 154.785, "propagation_delay": 4.645, "reason": "api_key_rotation"}, "reauthorization": null}, {"scenario_id": "arm-7-015", "arm": 7, "requester_id": "ddbc5259-56d7-6c05-f13c-4c8235dca22e", "action_type": "delegate", "resource": "item_7p9bxwtrixmm", "t_decision": 48.987, "t_bind": 62.939, "t_execution": 114.171, "multistep": false, "revocation": {"t_revoke": 111.407, "propagation_delay": 6.614, "reason": "emergency_shutdown"}, "reauthorization": null}, {"scenario_id": "arm-7-016", "arm": 7, "requester_id": "d7ed8bb5-ec1d-f31f-c344-db4ed40e2e0e", "action_type": "approve", "resource": "item_voggsvwx31da", "t_decision": 98.759, "t_bind": 120.267, "t_execution": 192.037, "multistep": false, "revocation": {"t_revoke": 190.085, "propagation_delay": 3.706, "reason": "employee_termination"}, "reauthorization": null}, {"scenario_id": "arm-7-017", "arm": 7, "requester_id": "a3bc025c-b1e9-0bee-abfe-3c0bea7d6f08", "action_type": "revoke", "resource": "res_kgjaltub4iou", "t_decision": 1.111, "t_bind": 6.766, "t_execution": 38.387, "multistep": false, "revocation": {"t_revoke": 37.025, "propagation_delay": 4.278, "reason": "emergency_shutdown"}, "reauthorization": null}, {"scenario_id": "arm-7-018", "arm": 7, "requester_id": "d0eacac4-9e8d-de42-6200-c6dd0dd2ec1e", "action_type": "revoke", "resource": "obj_ajtgj0rt72s8", "t_decision": 57.273, "t_bind": 74.614, "t_execution": 152.156, "multistep": false, "revocation": {"t_revoke": 151.334, "propagation_delay": 5.451, "reason": "employee_termination"}, "reauthorization": null}, {"scenario_id": "arm-7-019", "arm": 7, "requester_id": "bd3359c6-f09a-bf7b-6f37-1ebfe0c5d1ef", "action_type": "delegate", "resource": "res_avy98j4kn00j", "t_decision": 21.911, "t_bind": 51.366, "t_execution": 126.396, "multistep": false, "revocation": {"t_revoke": 124.751, "propagation_delay": 3.776, "reason": "emergency_shutdown"}, "reauthorization": null}, {"scenario_id": "arm-7-020", "arm": 7, "requester_id": "edaec0bf-d3cb-a8e0-0dd8-7f2d41a4cb4a", "action_type": "transfer", "resource": "res_mc0tt3vs1mcz", "t_decision": 21.074, "t_bind": 37.744, "t_execution": 74.466, "multistep": false, "revocation": {"t_revoke": 72.519, "propagation_delay": 6.189, "reason": "employee_termination"}, "reauthorization": null}, {"scenario_id": "arm-7-021", "arm": 7, "requester_id": "c5cbfcaa-7c40-b74f-61dc-11543abb5ffe", "action_type": "approve", "resource": "item_cxcblcy04uru", "t_decision": 51.411, "t_bind": 55.72, "t_execution": 87.825, "multistep": false, "revocation": {"t_revoke": 87.479, "propagation_delay": 4.418, "reason": "employee_termination"}, "reauthorization": null}, {"scenario_id": "arm-7-022", "arm": 7, "requester_id": "df9cc33d-4c49-e694-bfb2-d4fc7ce8d85f", "action_type": "approve", "resource": "res_5xfb96e6g91o", "t_decision": 97.52, "t_bind": 109.574, "t_execution": 229.0, "multistep": false, "revocation": {"t_revoke": 228.746, "propagation_delay": 3.981, "reason": "policy_change"}, "reauthorization": null}, {"scenario_id": "arm-7-023", "arm": 7, "requester_id": "4d7357a5-bd6e-4d5b-eefd-dde8cd3bced3", "action_type": "revoke", "resource": "obj_kkr33kt6oyc2", "t_decision": 49.874, "t_bind": 58.131, "t_execution": 155.486, "multistep": false, "revocation": {"t_revoke": 153.871, "propagation_delay": 3.912, "reason": "policy_change"}, "reauthorization": null}, {"scenario_id": "arm-7-024", "arm": 7, "requester_id": "6dfc07d9-cfc3-b9da-32b7-479ba2aadfd7", "action_type": "delegate", "resource": "res_rj7buf1q4rbo", "t_decision": 49.905, "t_bind": 61.837, "t_execution": 105.729, "multistep": false, "revocation": {"t_revoke": 103.568, "propagation_delay": 5.802, "reason": "credential_compromise"}, "reauthorization": null}, {"scenario_id": "arm-7-025", "arm": 7, "requester_id": "9ecbaebc-41b1-8eae-3ce8-cfdfbefbaebc", "action_type": "revoke", "resource": "obj_c59j1w5oovsi", "t_decision": 80.714, "t_bind": 108.796, "t_execution": 151.53, "multistep": false, "revocation": {"t_revoke": 151.265, "propagation_delay": 1.867, "reason": "policy_change"}, "reauthorization": null}, {"scenario_id": "arm-7-026", "arm": 7, "requester_id": "b35f025a-e02c-006b-de61-addcad66967e", "action_type": "transfer", "resource": "item_84puov9ybs6q", "t_decision": 52.764, "t_bind": 74.156, "t_execution": 130.953, "multistep": false, "revocation": {"t_revoke": 129.551, "propagation_delay": 2.646, "reason": "emergency_shutdown"}, "reauthorization": null}, {"scenario_id": "arm-7-027", "arm": 7, "requester_id": "8ea1a8be-69f0-dbd3-bbd1-3702cba68bcf", "action_type": "delegate", "resource": "res_hhocvc4svhjo", "t_decision": 71.359, "t_bind": 79.564, "t_execution": 146.927, "multistep": false, "revocation": {"t_revoke": 146.592, "propagation_d